[
  {
    "encoding": "bytecode",
    "exceptionRegions": [
      {
        "catchType": null,
        "end": 5,
        "filterStart": null,
        "handlerEnd": 10,
        "handlerStart": 5,
        "kind": "finally",
        "start": 0
      },
      {
        "catchType": "ref:System.Exception",
        "end": 10,
        "filterStart": null,
        "handlerEnd": 16,
        "handlerStart": 11,
        "kind": "catch",
        "start": 0
      },
      {
        "catchType": null,
        "end": 17,
        "filterStart": null,
        "handlerEnd": 22,
        "handlerStart": 17,
        "kind": "finally",
        "start": 0
      }
    ],
    "instructions": [
      {
        "inputTypes": [],
        "offset": 0,
        "opcode": "nop",
        "operands": [],
        "outputTypes": [],
        "resultType": "void",
        "sourceEncoding": "bytecode",
        "sourceOffset": 0,
        "sourceOpcode": "SEQ",
        "stackIn": [],
        "stackOut": [],
        "successors": [
          1
        ]
      },
      {
        "inputTypes": [],
        "offset": 1,
        "opcode": "constant",
        "operands": [
          "first"
        ],
        "outputTypes": [
          "ref:System.String"
        ],
        "resultType": "ref:System.String",
        "sourceEncoding": "bytecode",
        "sourceOffset": 1,
        "sourceOpcode": "CONST",
        "stackIn": [],
        "stackOut": [
          "ref:System.String"
        ],
        "successors": [
          2
        ]
      },
      {
        "inputTypes": [
          "ref:System.String"
        ],
        "offset": 2,
        "opcode": "call",
        "operands": [
          {
            "id": "builtin:33",
            "name": "Exception.new",
            "owner": null,
            "parameters": [
              "ref:System.String"
            ],
            "returnType": "ref:System.Exception",
            "voidResult": "null"
          }
        ],
        "outputTypes": [
          "ref:System.Exception"
        ],
        "resultType": "ref:System.Exception",
        "sourceEncoding": "bytecode",
        "sourceOffset": 2,
        "sourceOpcode": "BUILTIN",
        "stackIn": [
          "ref:System.String"
        ],
        "stackOut": [
          "ref:System.Exception"
        ],
        "successors": [
          3
        ]
      },
      {
        "inputTypes": [
          "ref:System.Exception"
        ],
        "offset": 3,
        "opcode": "throw",
        "operands": [],
        "outputTypes": [],
        "resultType": "void",
        "sourceEncoding": "bytecode",
        "sourceOffset": 3,
        "sourceOpcode": "THROW",
        "stackIn": [
          "ref:System.Exception"
        ],
        "stackOut": [],
        "successors": []
      },
      {
        "inputTypes": [],
        "offset": 4,
        "opcode": "leave",
        "operands": [
          10,
          {
            "unwindRegions": [
              0
            ]
          }
        ],
        "outputTypes": [],
        "resultType": "void",
        "sourceEncoding": "bytecode",
        "sourceOffset": 4,
        "sourceOpcode": "JUMP",
        "stackIn": [],
        "stackOut": [],
        "successors": [
          10
        ]
      },
      {
        "inputTypes": [],
        "offset": 5,
        "opcode": "nop",
        "operands": [],
        "outputTypes": [],
        "resultType": "void",
        "sourceEncoding": "bytecode",
        "sourceOffset": 5,
        "sourceOpcode": "SEQ",
        "stackIn": [],
        "stackOut": [],
        "successors": [
          6
        ]
      },
      {
        "inputTypes": [],
        "offset": 6,
        "opcode": "constant",
        "operands": [
          "inner"
        ],
        "outputTypes": [
          "ref:System.String"
        ],
        "resultType": "ref:System.String",
        "sourceEncoding": "bytecode",
        "sourceOffset": 6,
        "sourceOpcode": "CONST",
        "stackIn": [],
        "stackOut": [
          "ref:System.String"
        ],
        "successors": [
          7
        ]
      },
      {
        "inputTypes": [
          "ref:System.String"
        ],
        "offset": 7,
        "opcode": "call",
        "operands": [
          {
            "id": "builtin:0",
            "name": "Console.WriteLine",
            "owner": null,
            "parameters": [
              "any"
            ],
            "returnType": "void",
            "voidResult": "null"
          }
        ],
        "outputTypes": [
          "null"
        ],
        "resultType": "null",
        "sourceEncoding": "bytecode",
        "sourceOffset": 7,
        "sourceOpcode": "BUILTIN",
        "stackIn": [
          "ref:System.String"
        ],
        "stackOut": [
          "null"
        ],
        "successors": [
          8
        ]
      },
      {
        "inputTypes": [
          "null"
        ],
        "offset": 8,
        "opcode": "discard",
        "operands": [],
        "outputTypes": [],
        "resultType": "void",
        "sourceEncoding": "bytecode",
        "sourceOffset": 8,
        "sourceOpcode": "POP",
        "stackIn": [
          "null"
        ],
        "stackOut": [],
        "successors": [
          9
        ]
      },
      {
        "inputTypes": [],
        "offset": 9,
        "opcode": "end-finally",
        "operands": [],
        "outputTypes": [],
        "resultType": "void",
        "sourceEncoding": "bytecode",
        "sourceOffset": 9,
        "sourceOpcode": "ENDFINALLY",
        "stackIn": [],
        "stackOut": [],
        "successors": []
      },
      {
        "inputTypes": [],
        "offset": 10,
        "opcode": "branch",
        "operands": [
          16
        ],
        "outputTypes": [],
        "resultType": "void",
        "sourceEncoding": "bytecode",
        "sourceOffset": 10,
        "sourceOpcode": "JUMP",
        "stackIn": [],
        "stackOut": [],
        "successors": [
          16
        ]
      },
      {
        "inputTypes": [],
        "offset": 11,
        "opcode": "nop",
        "operands": [],
        "outputTypes": [],
        "resultType": "void",
        "sourceEncoding": "bytecode",
        "sourceOffset": 11,
        "sourceOpcode": "SEQ",
        "stackIn": [],
        "stackOut": [],
        "successors": [
          12
        ]
      },
      {
        "inputTypes": [],
        "offset": 12,
        "opcode": "constant",
        "operands": [
          "catch"
        ],
        "outputTypes": [
          "ref:System.String"
        ],
        "resultType": "ref:System.String",
        "sourceEncoding": "bytecode",
        "sourceOffset": 12,
        "sourceOpcode": "CONST",
        "stackIn": [],
        "stackOut": [
          "ref:System.String"
        ],
        "successors": [
          13
        ]
      },
      {
        "inputTypes": [
          "ref:System.String"
        ],
        "offset": 13,
        "opcode": "call",
        "operands": [
          {
            "id": "builtin:0",
            "name": "Console.WriteLine",
            "owner": null,
            "parameters": [
              "any"
            ],
            "returnType": "void",
            "voidResult": "null"
          }
        ],
        "outputTypes": [
          "null"
        ],
        "resultType": "null",
        "sourceEncoding": "bytecode",
        "sourceOffset": 13,
        "sourceOpcode": "BUILTIN",
        "stackIn": [
          "ref:System.String"
        ],
        "stackOut": [
          "null"
        ],
        "successors": [
          14
        ]
      },
      {
        "inputTypes": [
          "null"
        ],
        "offset": 14,
        "opcode": "discard",
        "operands": [],
        "outputTypes": [],
        "resultType": "void",
        "sourceEncoding": "bytecode",
        "sourceOffset": 14,
        "sourceOpcode": "POP",
        "stackIn": [
          "null"
        ],
        "stackOut": [],
        "successors": [
          15
        ]
      },
      {
        "inputTypes": [],
        "offset": 15,
        "opcode": "branch",
        "operands": [
          16
        ],
        "outputTypes": [],
        "resultType": "void",
        "sourceEncoding": "bytecode",
        "sourceOffset": 15,
        "sourceOpcode": "JUMP",
        "stackIn": [],
        "stackOut": [],
        "successors": [
          16
        ]
      },
      {
        "inputTypes": [],
        "offset": 16,
        "opcode": "leave",
        "operands": [
          22,
          {
            "unwindRegions": [
              2
            ]
          }
        ],
        "outputTypes": [],
        "resultType": "void",
        "sourceEncoding": "bytecode",
        "sourceOffset": 16,
        "sourceOpcode": "JUMP",
        "stackIn": [],
        "stackOut": [],
        "successors": [
          22
        ]
      },
      {
        "inputTypes": [],
        "offset": 17,
        "opcode": "nop",
        "operands": [],
        "outputTypes": [],
        "resultType": "void",
        "sourceEncoding": "bytecode",
        "sourceOffset": 17,
        "sourceOpcode": "SEQ",
        "stackIn": [],
        "stackOut": [],
        "successors": [
          18
        ]
      },
      {
        "inputTypes": [],
        "offset": 18,
        "opcode": "constant",
        "operands": [
          "outer"
        ],
        "outputTypes": [
          "ref:System.String"
        ],
        "resultType": "ref:System.String",
        "sourceEncoding": "bytecode",
        "sourceOffset": 18,
        "sourceOpcode": "CONST",
        "stackIn": [],
        "stackOut": [
          "ref:System.String"
        ],
        "successors": [
          19
        ]
      },
      {
        "inputTypes": [
          "ref:System.String"
        ],
        "offset": 19,
        "opcode": "call",
        "operands": [
          {
            "id": "builtin:0",
            "name": "Console.WriteLine",
            "owner": null,